{
  "$schema": "https://json-schema.org/draft/2020-12/schema",
  "$id": "https://squadflow.dev/schemas/project.json",
  "title": "Project",
  "description": "A temporary initiative with a defined start, scope, and end.",
  "type": "object",
  "required": ["id", "name", "company_id", "owner_id", "squad_ids", "state", "created_at", "updated_at"],
  "properties": {
    "id":           { "type": "string", "format": "uuid" },
    "name":         { "type": "string", "minLength": 1, "maxLength": 200 },
    "description":  { "type": ["string", "null"] },
    "company_id":   { "type": "string", "format": "uuid" },
    "brand_id":     { "type": ["string", "null"], "format": "uuid" },
    "owner_id":     { "type": "string", "format": "uuid" },
    "squad_ids": {
      "type": "array",
      "minItems": 1,
      "items": { "type": "string", "format": "uuid" },
      "uniqueItems": true
    },
    "okr_ids": {
      "type": "array",
      "items": { "type": "string", "format": "uuid" },
      "uniqueItems": true
    },
    "state": {
      "type": "string",
      "enum": ["idea", "scoping", "backlog", "active", "delivery", "closed"]
    },
    "close_reason": {
      "type": ["string", "null"],
      "enum": ["delivered", "canceled", "absorbed", null]
    },
    "absorbed_into_factory_id": { "type": ["string", "null"], "format": "uuid" },
    "start_date":   { "type": ["string", "null"], "format": "date" },
    "end_date":     { "type": ["string", "null"], "format": "date" },
    "created_at":   { "type": "string", "format": "date-time" },
    "updated_at":   { "type": "string", "format": "date-time" }
  },
  "additionalProperties": false
}
