{
  "id": "b2c3d4e5-f6a7-4789-b012-3456789abcde",
  "name": "Billing Migration",
  "description": "Migrate from custom billing to Stripe.",
  "company_id": "a1b2c3d4-e5f6-4789-a012-3456789abcde",
  "brand_id": null,
  "owner_id": "c1d2e3f4-a5b6-4789-c012-3456789abcde",
  "squad_ids": ["e1f2a3b4-c5d6-4789-e012-3456789abcde"],
  "okr_ids": ["f1a2b3c4-d5e6-4789-f012-3456789abcde"],
  "state": "active",
  "close_reason": null,
  "absorbed_into_factory_id": null,
  "start_date": "2026-02-15",
  "end_date": null,
  "created_at": "2026-01-20T10:00:00Z",
  "updated_at": "2026-04-19T10:00:00Z"
}
